{"diagnosis":"Candidate/bad runs overrepeat unchanged interactions, especially clicks, no-ops/waits, and scrolling, instead of adapting after unchanged evidence.","expected_mechanism":"Detecting unchanged state before retrying should interrupt unproductive loops and force diagnosis, strategy change, or a clear stop. Cost: lightweight action/state history and occasional premature switching when a transient failure needed another retry.","policy_text":"Before repeating an action on the same target, compare the latest observation with the prior one. If neither state nor evidence changed, do not retry unchanged: inspect prerequisites, choose a materially different action, or stop and report the blocker. Permit one retry only for a plausible transient failure.","quantitative_evidence":[{"command":"go tool pprof -top agentreward-338-pairs-bad-minus-good.operations.pb.gz","finding":"result:repeated has +1,261 operations, equal to 11.31% of the profile's +11,146 net differential total; positive values denote candidate/bad excess."},{"command":"go tool pprof -top -focus='result:repeated' agentreward-338-pairs-bad-minus-good.operations.pb.gz","finding":"Within repeated-result stacks, the largest positive action excesses are click +639, noop +356, and scroll +277. Positive strategy excesses include inspect +602, wait +356, and navigate +306."},{"command":"go tool pprof -traces -focus='result:repeated' agentreward-338-pairs-bad-minus-good.operations.pb.gz","finding":"The traces reproduce concrete repeated sequences, including repeated clicks on the same search target under the subtask try_the_search_again, confirming recurrence at individual-step level."}]}